{
  "schemaVersion": "1.0.0",
  "clientId": "11111111-1111-4111-8111-111111111111",
  "displayAlias": "Synthetic Client",
  "operatorAlias": "Test Operator",
  "createdAt": "2026-08-25T08:00:00Z",
  "updatedAt": "2026-08-25T08:10:00Z",
  "status": "ACTIVE",
  "dictionaryVersion": "1.0.0",
  "jobIds": [
    "PB-20260825-0123456789"
  ],
  "policy": {
    "autoLockMinutes": 15,
    "reviewDisplayThreshold": 0.7,
    "locale": "zh-TW"
  }
}
